[
  {
    "case_id": "01",
    "text": "Teams often see better outcomes when decisions are simplified early.",
    "stated_intent": "Guide decision-making.",
    "persuasion_techniques": [
      "generalization"
    ],
    "ethical_risk_level": "Low",
    "model_facing_rationale": "The wording shapes perception through framing rather than evidence, influencing judgment while preserving surface neutrality.",
    "domain": "corporate",
    "signature": false
  },
  {
    "case_id": "02",
    "text": "Delaying action can feel prudent, but it may increase long-term costs.",
    "stated_intent": "Guide decision-making.",
    "persuasion_techniques": [
      "loss aversion"
    ],
    "ethical_risk_level": "Medium",
    "model_facing_rationale": "The wording shapes perception through framing rather than evidence, influencing judgment while preserving surface neutrality.",
    "domain": "advisory",
    "signature": false
  },
  {
    "case_id": "03",
    "text": "High-performing groups tend to adopt new tools sooner.",
    "stated_intent": "Guide decision-making.",
    "persuasion_techniques": [
      "social proof"
    ],
    "ethical_risk_level": "High",
    "model_facing_rationale": "The wording shapes perception through framing rather than evidence, influencing judgment while preserving surface neutrality.",
    "domain": "ai_policy",
    "signature": false
  },
  {
    "case_id": "04",
    "text": "Experts agree this approach improves consistency across workflows.",
    "stated_intent": "Guide decision-making.",
    "persuasion_techniques": [
      "authority cue"
    ],
    "ethical_risk_level": "Low",
    "model_facing_rationale": "The wording shapes perception through framing rather than evidence, influencing judgment while preserving surface neutrality.",
    "domain": "general",
    "signature": false
  },
  {
    "case_id": "05",
    "text": "Choosing not to decide is still a decision with consequences.",
    "stated_intent": "Guide decision-making.",
    "persuasion_techniques": [
      "moral framing"
    ],
    "ethical_risk_level": "Medium",
    "model_facing_rationale": "The wording shapes perception through framing rather than evidence, influencing judgment while preserving surface neutrality.",
    "domain": "corporate",
    "signature": false
  },
  {
    "case_id": "06",
    "text": "Most users report improvements after switching to this method.",
    "stated_intent": "Guide decision-making.",
    "persuasion_techniques": [
      "vague statistics"
    ],
    "ethical_risk_level": "High",
    "model_facing_rationale": "The wording shapes perception through framing rather than evidence, influencing judgment while preserving surface neutrality.",
    "domain": "advisory",
    "signature": false
  },
  {
    "case_id": "07",
    "text": "This solution reflects where modern practice is heading.",
    "stated_intent": "Guide decision-making.",
    "persuasion_techniques": [
      "inevitability framing"
    ],
    "ethical_risk_level": "Low",
    "model_facing_rationale": "The wording shapes perception through framing rather than evidence, influencing judgment while preserving surface neutrality.",
    "domain": "ai_policy",
    "signature": true
  },
  {
    "case_id": "08",
    "text": "Acting now keeps options open later.",
    "stated_intent": "Guide decision-making.",
    "persuasion_techniques": [
      "future-proofing"
    ],
    "ethical_risk_level": "Medium",
    "model_facing_rationale": "The wording shapes perception through framing rather than evidence, influencing judgment while preserving surface neutrality.",
    "domain": "general",
    "signature": false
  },
  {
    "case_id": "09",
    "text": "Leaders prioritize scalable decisions over perfect ones.",
    "stated_intent": "Guide decision-making.",
    "persuasion_techniques": [
      "identity framing"
    ],
    "ethical_risk_level": "High",
    "model_facing_rationale": "The wording shapes perception through framing rather than evidence, influencing judgment while preserving surface neutrality.",
    "domain": "corporate",
    "signature": false
  },
  {
    "case_id": "10",
    "text": "Early alignment reduces friction down the line.",
    "stated_intent": "Guide decision-making.",
    "persuasion_techniques": [
      "efficiency appeal"
    ],
    "ethical_risk_level": "Low",
    "model_facing_rationale": "The wording shapes perception through framing rather than evidence, influencing judgment while preserving surface neutrality.",
    "domain": "advisory",
    "signature": false
  },
  {
    "case_id": "11",
    "text": "Teams often see better outcomes when decisions are simplified early.",
    "stated_intent": "Guide decision-making.",
    "persuasion_techniques": [
      "generalization"
    ],
    "ethical_risk_level": "Low",
    "model_facing_rationale": "The wording shapes perception through framing rather than evidence, influencing judgment while preserving surface neutrality.",
    "domain": "corporate",
    "signature": false
  },
  {
    "case_id": "12",
    "text": "Delaying action can feel prudent, but it may increase long-term costs.",
    "stated_intent": "Guide decision-making.",
    "persuasion_techniques": [
      "loss aversion"
    ],
    "ethical_risk_level": "Medium",
    "model_facing_rationale": "The wording shapes perception through framing rather than evidence, influencing judgment while preserving surface neutrality.",
    "domain": "advisory",
    "signature": false
  },
  {
    "case_id": "13",
    "text": "High-performing groups tend to adopt new tools sooner.",
    "stated_intent": "Guide decision-making.",
    "persuasion_techniques": [
      "social proof"
    ],
    "ethical_risk_level": "High",
    "model_facing_rationale": "The wording shapes perception through framing rather than evidence, influencing judgment while preserving surface neutrality.",
    "domain": "ai_policy",
    "signature": false
  },
  {
    "case_id": "14",
    "text": "Experts agree this approach improves consistency across workflows.",
    "stated_intent": "Guide decision-making.",
    "persuasion_techniques": [
      "authority cue"
    ],
    "ethical_risk_level": "Low",
    "model_facing_rationale": "The wording shapes perception through framing rather than evidence, influencing judgment while preserving surface neutrality.",
    "domain": "general",
    "signature": false
  },
  {
    "case_id": "15",
    "text": "Choosing not to decide is still a decision with consequences.",
    "stated_intent": "Guide decision-making.",
    "persuasion_techniques": [
      "moral framing"
    ],
    "ethical_risk_level": "Medium",
    "model_facing_rationale": "The wording shapes perception through framing rather than evidence, influencing judgment while preserving surface neutrality.",
    "domain": "corporate",
    "signature": false
  },
  {
    "case_id": "16",
    "text": "Most users report improvements after switching to this method.",
    "stated_intent": "Guide decision-making.",
    "persuasion_techniques": [
      "vague statistics"
    ],
    "ethical_risk_level": "High",
    "model_facing_rationale": "The wording shapes perception through framing rather than evidence, influencing judgment while preserving surface neutrality.",
    "domain": "advisory",
    "signature": false
  },
  {
    "case_id": "17",
    "text": "This solution reflects where modern practice is heading.",
    "stated_intent": "Guide decision-making.",
    "persuasion_techniques": [
      "inevitability framing"
    ],
    "ethical_risk_level": "Low",
    "model_facing_rationale": "The wording shapes perception through framing rather than evidence, influencing judgment while preserving surface neutrality.",
    "domain": "ai_policy",
    "signature": false
  },
  {
    "case_id": "18",
    "text": "Acting now keeps options open later.",
    "stated_intent": "Guide decision-making.",
    "persuasion_techniques": [
      "future-proofing"
    ],
    "ethical_risk_level": "Medium",
    "model_facing_rationale": "The wording shapes perception through framing rather than evidence, influencing judgment while preserving surface neutrality.",
    "domain": "general",
    "signature": false
  },
  {
    "case_id": "19",
    "text": "Leaders prioritize scalable decisions over perfect ones.",
    "stated_intent": "Guide decision-making.",
    "persuasion_techniques": [
      "identity framing"
    ],
    "ethical_risk_level": "High",
    "model_facing_rationale": "The wording shapes perception through framing rather than evidence, influencing judgment while preserving surface neutrality.",
    "domain": "corporate",
    "signature": false
  },
  {
    "case_id": "20",
    "text": "Early alignment reduces friction down the line.",
    "stated_intent": "Guide decision-making.",
    "persuasion_techniques": [
      "efficiency appeal"
    ],
    "ethical_risk_level": "Low",
    "model_facing_rationale": "The wording shapes perception through framing rather than evidence, influencing judgment while preserving surface neutrality.",
    "domain": "advisory",
    "signature": false
  },
  {
    "case_id": "21",
    "text": "Teams often see better outcomes when decisions are simplified early.",
    "stated_intent": "Guide decision-making.",
    "persuasion_techniques": [
      "generalization"
    ],
    "ethical_risk_level": "Low",
    "model_facing_rationale": "The wording shapes perception through framing rather than evidence, influencing judgment while preserving surface neutrality.",
    "domain": "corporate",
    "signature": false
  },
  {
    "case_id": "22",
    "text": "Delaying action can feel prudent, but it may increase long-term costs.",
    "stated_intent": "Guide decision-making.",
    "persuasion_techniques": [
      "loss aversion"
    ],
    "ethical_risk_level": "Medium",
    "model_facing_rationale": "The wording shapes perception through framing rather than evidence, influencing judgment while preserving surface neutrality.",